{
  "id": "LQ-204",
  "description": "datum s časem",
  "context": "html",
  "level": "compiled",
  "template": "{{ contact.signup_at | date: \"%d.%m.%Y %H:%M\" }}",
  "data": {
    "contact": {
      "signup_at": "2026-08-01T12:40:00Z"
    },
    "_context": {
      "timezone": "Europe/Prague"
    }
  },
  "expected": "01.08.2026 14:40"
}
