{
  "id": "LQ-201",
  "description": "formát %d.%m.%Y v zóně Europe/Prague",
  "context": "html",
  "level": "compiled",
  "template": "{{ contact.signup_at | date: \"%d.%m.%Y\" }}",
  "data": {
    "contact": {
      "signup_at": "2026-08-01T12:40:00Z"
    },
    "_context": {
      "timezone": "Europe/Prague"
    }
  },
  "expected": "01.08.2026"
}
